Nom_du_POI,Categories_de_POI,Latitude,Longitude,Adresse_postale,Code_postal_et_commune,Periodes_regroupees,Covid19_mesures_specifiques,Covid19_est_en_activite,Covid19_periodes_d_ouvertures_confirmees,Createur_de_la_donnee,SIT_diffuseur,Date_de_mise_a_jour,Contacts_du_POI,Classements_du_POI,Description,URI_ID_du_POI
Kosten Plage,https://www.datatourisme.fr/ontology/core#FoodEstablishment|https://www.datatourisme.fr/ontology/core#PlaceOfInterest|https://www.datatourisme.fr/ontology/core#PointOfInterest|http://schema.org/FoodEstablishment,41.531822,9.274982,Plage de Santa Giulia Face au ponton,20137#Porto-Vecchio,,,,,Porto Vecchio Tourisme,Apidae Tourisme Scic SA - source : Apidae Tourisme,2023-02-14,#+33 7 61 29 21 97#kosten20137@gmail.com#http://www.kosten.fr/plage,,"La paillotte du Køstën Plage se situe à Santa Giulia, une des plus belles plages de Corse.",https://data.datatourisme.fr/13/902290d7-fa38-34d3-8ba0-f33af3487dd4
Le Figuier,https://www.datatourisme.fr/ontology/core#FoodEstablishment|https://www.datatourisme.fr/ontology/core#PlaceOfInterest|https://www.datatourisme.fr/ontology/core#PointOfInterest|http://schema.org/FoodEstablishment,41.624046,9.297304,Route de Cala Rossa Trinité de Porto-Vecchio,20137#Porto-Vecchio,,,,,Porto Vecchio Tourisme,Apidae Tourisme Scic SA - source : Apidae Tourisme,2023-02-15,#+33 4 95 72 08 78#le-figuier@orange.fr#,,"Crée en 1983 par deux frères, Paul et Jean-Noël Cucchi, Le Figuier vous propose des pizzas et des grillades au feu de bois, des pâtes fraîches, des entrées savoureuses et élaborées, des desserts maison gourmands... et chaque jour une nouvelle suggestion !",https://data.datatourisme.fr/13/2adc3e32-2c68-3c9b-bf90-bd689fcc5aa0
Kalliste Raid 4x4,https://www.datatourisme.fr/ontology/core#PlaceOfInterest|https://www.datatourisme.fr/ontology/core#PointOfInterest|https://www.datatourisme.fr/ontology/core#SportsAndLeisurePlace,41.592145,9.213388,Muratello,20137#Porto-Vecchio,,,,,Porto Vecchio Tourisme,Apidae Tourisme Scic SA - source : Apidae Tourisme,2023-01-24,#+33 6 63 17 38 25#vallijacques2@gmail.com#https://www.kalliste4x4.com/,,"Excursions en 4X4 dans l'Alta Rocca, pour découvrir la Corse authentique, sur routes et pistes, de l'Ospédale à Bavella sans oublier le magnifique plateau de Cuscionu et autres. Le repas est inclus et se fera au restaurant ou sous forme de pique-nique.",https://data.datatourisme.fr/13/c35f4834-39a7-3642-a85b-72960fa2e4e3
Comptoir des Mers,https://www.datatourisme.fr/ontology/core#PlaceOfInterest|https://www.datatourisme.fr/ontology/core#PointOfInterest|https://www.datatourisme.fr/ontology/core#ActivityProvider|https://www.datatourisme.fr/ontology/core#Store|http://schema.org/LocalBusiness,41.596315,9.27968,Avenue Georges Pompidou Immeuble Rondina Marina,20137#Porto-Vecchio,,,,,Porto Vecchio Tourisme,Apidae Tourisme Scic SA - source : Apidae Tourisme,2022-10-19,#+33 4 95 21 82 82#poliservices@wanadoo.fr#https://www.comptoirdesmers-corse.com/,,"Depuis plus de 15 ans, à 900 m. du port de Porto-Vecchio, tout l'équipement nécessaire pour profiter pleinement de la mer tout en la respectant ! 
Accastillage, navigation, pêche en mer, snorkeling, chasse sous-marine, sports de glisse, location.",https://data.datatourisme.fr/13/3c4574f5-3073-3351-a17e-0a907262c10d
IsulaBike,https://www.datatourisme.fr/ontology/core#PlaceOfInterest|https://www.datatourisme.fr/ontology/core#PointOfInterest|https://www.datatourisme.fr/ontology/core#ActivityProvider|https://www.datatourisme.fr/ontology/core#Store|http://schema.org/LocalBusiness,41.578285,9.274765,Route de Bonifacio Station VITO / EPB,20137#Porto-Vecchio,,,,,Porto Vecchio Tourisme,Apidae Tourisme Scic SA - source : Apidae Tourisme,2023-02-15,#+33 6 23 58 19 53#info@isulabike.com#https://www.isulabike.com/guide/,,"Profitez pleinement de vos vacances à vélo en Corse, en famille, entre amis ou en solo, accompagnés par des guides professionnels ! Petites routes pittoresques, circuits de découverte ou coins insolites… La Corse n’aura plus de secret pour vous !",https://data.datatourisme.fr/13/f30a1038-6131-3181-9116-57ef6e4f15f9
Chez Dumè,https://www.datatourisme.fr/ontology/core#FoodEstablishment|https://www.datatourisme.fr/ontology/core#PlaceOfInterest|https://www.datatourisme.fr/ontology/core#PointOfInterest|http://schema.org/FoodEstablishment,42.566519,8.757862,Place de l'église Rue Clemenceau,20260#Calvi,,,,,Office de Tourisme Intercommunal Calvi - Balagne,Apidae Tourisme Scic SA - source : Apidae Tourisme,2022-05-03,#+33 4 95 65 09 83<>+33 6 81 67 68 60#tealdiq@gmail.com#,,"Le Restaurant Chez Dumè, à Calvi en Balagne, vous fera découvrir une cuisine régionale de tradition et vous donnera un aperçu de la gastronomie corse.",https://data.datatourisme.fr/13/824cf757-abab-34be-837d-d6b662d1f134
Pépite Food Truck,https://www.datatourisme.fr/ontology/core#FoodEstablishment|https://www.datatourisme.fr/ontology/core#PlaceOfInterest|https://www.datatourisme.fr/ontology/core#PointOfInterest|http://schema.org/FoodEstablishment,41.598163,9.266152,Route de Muratello Parking de Gamm Vert,20137#Porto-Vecchio,,,,,Porto Vecchio Tourisme,Apidae Tourisme Scic SA - source : Apidae Tourisme,2023-02-15,#+33 6 25 09 26 44#lapepite2a@gmail.com#http://www.xn--ppite-bsa.net/,,"Food Truck de pâtisseries fines et snacking healthy travaillant avec 70% de produits locaux Corses et de saison, 20% de produits Français et 10% de produits importés mais dans une démarche équitable et éco-responsable. Fait maison artisanal !",https://data.datatourisme.fr/13/d8472fc6-e401-3057-883a-4ca5f585fc53
L'Alivi,https://www.datatourisme.fr/ontology/core#FoodEstablishment|https://www.datatourisme.fr/ontology/core#PlaceOfInterest|https://www.datatourisme.fr/ontology/core#PointOfInterest|http://schema.org/FoodEstablishment,41.623853,9.300094,Route de Pezza Cardo Trinté de Porto-Vecchio,20137#Porto-Vecchio,,,,,Porto Vecchio Tourisme,Apidae Tourisme Scic SA - source : Apidae Tourisme,2023-02-14,#+33 4 95 21 80 22#alivi20137@gmail.com#,,"Dans son cadre chaleureux à l'abri des oliviers, l'Alivi vous propose une cuisine tournée vers l'authentique. Avec ses pizzas, viandes et poissons frais au feu de bois, les spécialités corses s'inviteront également à votre table pour un moment convivial.",https://data.datatourisme.fr/13/ad26db29-06f1-3b3d-b34b-673155895346
Exclusive Sailing,https://www.datatourisme.fr/ontology/core#PlaceOfInterest|https://www.datatourisme.fr/ontology/core#PointOfInterest|https://www.datatourisme.fr/ontology/core#SportsAndLeisurePlace|https://www.datatourisme.fr/ontology/core#SightseeingBoat|http://schema.org/LocalBusiness,41.524123,9.272116,Baie de Santa Giulia Ponton de l'hôtel Moby Dick,20137#Porto-Vecchio,,,,,Porto Vecchio Tourisme,Apidae Tourisme Scic SA - source : Apidae Tourisme,2023-04-01,#+33 6 25 81 20 84#exclusive.sailing.bw@gmail.com#http://www.croisiere-exclusive.fr/,,"Cap au large à bord de notre Maxi-Catamaran CIAO pour une navigation dans la Réserve Naturelle des Bouches de Bonifacio. Arrêt de 2h30 pour déjeuner dans l’un de nos plus beaux spots : les Îles Lavezzi, Sperone... au gré du vent. Privatisation possible.",https://data.datatourisme.fr/13/ef3c2fa1-cca7-3b60-ba82-67bf3c1ed908
Les Voiles de Porto-Vecchio,https://www.datatourisme.fr/ontology/core#PlaceOfInterest|https://www.datatourisme.fr/ontology/core#PointOfInterest|https://www.datatourisme.fr/ontology/core#SportsAndLeisurePlace|https://www.datatourisme.fr/ontology/core#SightseeingBoat|http://schema.org/LocalBusiness,41.589858,9.28319,Capitainerie du Port de Plaisance,20137#Porto-Vecchio,,,,,Porto Vecchio Tourisme,Apidae Tourisme Scic SA - source : Apidae Tourisme,2023-04-01,#+33 6 31 07 61 16#info@voilesdeportovecchio.com#,,"Croisière en catamaran à voile au départ du port de Porto-Vecchio. Découverte des plus beaux sites (Pinarello, Saint Cyprien, Îles Cerbicale, Porto Novo...). Possibilité de repas à bord - Escales Snorkeling, Paddle board - Privatisation sur demande.",https://data.datatourisme.fr/13/7ef5b6d8-6955-3298-866d-ae0db5280682
Diving Calvi - A Piaghja,https://www.datatourisme.fr/ontology/core#PlaceOfInterest|https://www.datatourisme.fr/ontology/core#PointOfInterest|https://www.datatourisme.fr/ontology/core#ActivityProvider|https://www.datatourisme.fr/ontology/core#Store|http://schema.org/LocalBusiness,42.55533,8.773898,Plage de calvi,20260#Calvi,,,,,Office de Tourisme Intercommunal Calvi - Balagne,Apidae Tourisme Scic SA - source : Apidae Tourisme,2023-01-20,#+33 6 81 29 99 46#divingcalvi@yahoo.fr#https://www.divingcalvi.fr/,,"Idéalement situé sur la plage de Calvi, à l’ombre des pins, Diving Calvi – A Piaghja vous invite, en toute convivialité, à partager sa passion de la plongée sous-marine au cœur d’un cadre exceptionnel.",https://data.datatourisme.fr/13/94d6f78a-3d7b-3a3b-857a-ebf5313baf66
Kasano,https://www.datatourisme.fr/ontology/core#PlaceOfInterest|https://www.datatourisme.fr/ontology/core#PointOfInterest|https://www.datatourisme.fr/ontology/core#Accommodation|https://www.datatourisme.fr/ontology/core#Hotel|https://www.datatourisme.fr/ontology/core#HotelTrade|http://schema.org/Accommodation|http://schema.org/LodgingBusiness|http://schema.org/Hotel,42.568126,8.757943,Avenue de l'Uruguay,20260#Calvi,,,,,Office de Tourisme Intercommunal Calvi - Balagne,Apidae Tourisme Scic SA - source : Apidae Tourisme,2022-08-30,#+33 6 82 15 47 66#info@hotelkasano.com#https://www.hotelkasano.com/fr,,"Kasano hôtel & spa, à la décoration vintage et l’esprit seventies, est posé au pied de la citadelle de Calvi. Vos hôtes, Léria et Lolla Ceccaldi, ont grandi dans l’hôtellerie et l’art du bien recevoir.",https://data.datatourisme.fr/13/9c59816b-2e2c-3ebf-9a44-9a0ad046e886
L'Alivu,https://www.datatourisme.fr/ontology/core#FoodEstablishment|https://www.datatourisme.fr/ontology/core#PlaceOfInterest|https://www.datatourisme.fr/ontology/core#PointOfInterest|http://schema.org/FoodEstablishment,42.508436,8.855083,Place Prince Pierre,20214#Calenzana,,,,,Office de Tourisme Intercommunal Calvi - Balagne,Apidae Tourisme Scic SA - source : Apidae Tourisme,2022-05-03,#+33 4 95 46 37 41<>+33 6 82 84 00 88#lalivucalenzana@gmail.com#,,"En plein coeur du village de Calenzana en Balagne en Corse, sous l'église St Blaise, ce restaurant vous ravira par sa cuisine authentique et chaleureuse comme ses propriétaires",https://data.datatourisme.fr/13/ed2dc260-8c8a-325c-8ebc-e65e8d201c36
"I Stritonni, le sentier du patrimoine de Monacia d'Aullène",https://www.datatourisme.fr/ontology/core#PlaceOfInterest|https://www.datatourisme.fr/ontology/core#PointOfInterest|https://www.datatourisme.fr/ontology/core#SportsAndLeisurePlace|https://www.datatourisme.fr/ontology/core#Tour|https://www.datatourisme.fr/ontology/core#WalkingTour|https://www.datatourisme.fr/ontology/core#EducationalTrail|http://purl.org/ontology/olo/core#OrderedList,41.512668,9.010952,D50 Lieu dit Caserne,20171#Monacia-d'Aullène,,,,,Porto Vecchio Tourisme,Apidae Tourisme Scic SA - source : Apidae Tourisme,2022-04-20,#+33 4 95 71 81 09##https://monacia-aullene.fr/,,"« I stritonni » qui signifie « petits chemins » en corse, est une boucle de 4 km, pour un temps de parcours de 2 heures environ. 
Une agréable balade familiale, à la redécouverte d’un chemin d’autrefois, accessible et adapté à tous.",https://data.datatourisme.fr/13/3f1d6ca4-c790-3687-8a85-56b4baff0d23
Restaurant - Chambres d'hôtes - Terra Bella,https://www.datatourisme.fr/ontology/core#FoodEstablishment|https://www.datatourisme.fr/ontology/core#PlaceOfInterest|https://www.datatourisme.fr/ontology/core#PointOfInterest|http://schema.org/FoodEstablishment,41.680092,9.318461,La Croix de Lecci,20137#Lecci,,,,,Porto Vecchio Tourisme,Apidae Tourisme Scic SA - source : Apidae Tourisme,2023-02-20,#+33 4 95 27 02 07#societebdt@orange.fr#https://www.terrabella-corse.fr/,,"Venez déguster nos pizzas, burgers et salades entièrement faits maison avec des produits locaux de qualité! Situés sur la route de Bastia au coeur du village de Lecci, vous pourrez profiter de notre terrasse arrière ombragée pour passer un bon moment !",https://data.datatourisme.fr/13/69f7968b-858e-333e-860c-8fe904566bf7
Corsica Sailing,https://www.datatourisme.fr/ontology/core#PlaceOfInterest|https://www.datatourisme.fr/ontology/core#PointOfInterest|https://www.datatourisme.fr/ontology/core#SportsAndLeisurePlace|https://www.datatourisme.fr/ontology/core#SightseeingBoat|http://schema.org/LocalBusiness,41.474748,9.071887,Port de Pianottoli Caldarello,20131#Pianottoli-Caldarello,,,,,Porto Vecchio Tourisme,Apidae Tourisme Scic SA - source : Apidae Tourisme,2023-04-01,#+33 6 60 65 39 90<>+33 7 67 25 42 83#corsicasailing@gmail.com#http://www.corsicasailing.com/,,Location de catamarans en sortie journée privative avec skipper (de 1300 € à 1600 € hors repas pour 12 personnes max) ou à la semaine au départ du port de Pianottoli / Figari les samedis et dimanches. Devis sur demande. N'hésitez pas à nous contacter !,https://data.datatourisme.fr/13/a32e86b1-d8ee-3a42-86bc-02b478aa0d13
Vesna Rossa,https://www.datatourisme.fr/ontology/core#PlaceOfInterest|https://www.datatourisme.fr/ontology/core#PointOfInterest|https://www.datatourisme.fr/ontology/core#Accommodation|https://www.datatourisme.fr/ontology/core#CollectiveAccommodation|https://www.datatourisme.fr/ontology/core#HolidayResort|http://schema.org/Accommodation|http://schema.org/LodgingBusiness,41.625011,9.335586,24 lotissement Marina Rossa,20137#Lecci,,,,,Porto Vecchio Tourisme,Apidae Tourisme Scic SA - source : Apidae Tourisme,2023-02-15,#+33 4 95 71 43 68#contact@vesnarossa.com#https://www.pierreetvacances.com/,,"RESIDENCE PREMIUM PIERRE & VACANCES. 
Villas avec piscines privatives chauffées à 300 m de la plage de Cala Rossa.
Une situation exceptionnelle pour des maisons tout confort. 
Salles d'eaux individuelles par chambre et grands espaces.",https://data.datatourisme.fr/13/ac176aa3-67f0-3ee5-9336-6a84a80cfd99
Son De Mar,https://www.datatourisme.fr/ontology/core#FoodEstablishment|https://www.datatourisme.fr/ontology/core#PlaceOfInterest|https://www.datatourisme.fr/ontology/core#PointOfInterest|https://www.datatourisme.fr/ontology/core#Restaurant|https://www.datatourisme.fr/ontology/core#Accommodation|https://www.datatourisme.fr/ontology/core#Hotel|https://www.datatourisme.fr/ontology/core#HotelRestaurant|https://www.datatourisme.fr/ontology/core#HotelTrade|http://schema.org/Accommodation|http://schema.org/FoodEstablishment|http://schema.org/LodgingBusiness|http://schema.org/Restaurant|http://schema.org/Hotel,41.638498,9.346679,27 Corsu Napoleonu San Ciprianu,20137#Lecci,,,,,Porto Vecchio Tourisme,Apidae Tourisme Scic SA - source : Apidae Tourisme,2023-03-10,#+33 4 20 19 03 35#front@sondemar.fr#https://sondemar.fr/,,"Comme une ode au farniente et au bien être, le Son De Mar a vu le jour au printemps 2022. Au cœur du village marin de San Ciprianu, à deux pas de l'eau. 
Le spa et la table complètent l'expérience d'un séjour unique, entre simplicité et raffinement.",https://data.datatourisme.fr/13/5435b940-d400-3ab9-8842-75e7b3457818
Ghisoni's Coffee House,https://www.datatourisme.fr/ontology/core#FoodEstablishment|https://www.datatourisme.fr/ontology/core#PlaceOfInterest|https://www.datatourisme.fr/ontology/core#PointOfInterest|http://schema.org/FoodEstablishment,41.666977,9.30719,Lieu dit Ciaccone Pont de l'Oso,20137#Lecci,,,,,Porto Vecchio Tourisme,Apidae Tourisme Scic SA - source : Apidae Tourisme,2023-02-14,#+33 4 95 25 96 91#contact@ghisoni-mariotti.com#https://ghisoni-mariotti.com/,,"De 6h à 22h non stop - petit déjeuner - service du midi (salades, burgers, plats du jour), brunch tous les dimanches. Grand choix de bières du monde - Salon de thé. Service continu.",https://data.datatourisme.fr/13/67c36de7-d88f-39c1-81ff-fe839c61cd9c
Résidence Saletta Mare,https://www.datatourisme.fr/ontology/core#PlaceOfInterest|https://www.datatourisme.fr/ontology/core#PointOfInterest|https://www.datatourisme.fr/ontology/core#Accommodation|https://www.datatourisme.fr/ontology/core#CollectiveAccommodation|https://www.datatourisme.fr/ontology/core#HolidayResort|http://schema.org/Accommodation|http://schema.org/LodgingBusiness,42.632894,8.944848,1 Bd Charles Marie Savelli,20220#L'Île-Rousse,,,,,Office de Tourisme Intercommunal de L'Ile Rousse-Balagne,Apidae Tourisme Scic SA - source : Apidae Tourisme,2023-02-03,#+33 4 95 31 60 52#reservation@residence-saletta.com#http://www.residences-saletta.com/,,"La Résidence Saletta Mare vous accueille à l'Île Rousse, à deux pas de la plage. Dans une résidence de standing avec piscine à débordement, dans des appartements modernes, et de nombreux services à disposition tel qu'une salle de courtoisie.",https://data.datatourisme.fr/13/92195640-854c-33ad-8641-4d6dc19ef560
Le Balamina,https://www.datatourisme.fr/ontology/core#PlaceOfInterest|https://www.datatourisme.fr/ontology/core#PointOfInterest|https://www.datatourisme.fr/ontology/core#Accommodation|https://www.datatourisme.fr/ontology/core#CollectiveAccommodation|https://www.datatourisme.fr/ontology/core#HolidayResort|http://schema.org/Accommodation|http://schema.org/LodgingBusiness,41.599358,9.268614,21 rue des Turriccioli,20137#Porto-Vecchio,,,,,Porto Vecchio Tourisme,Apidae Tourisme Scic SA - source : Apidae Tourisme,2022-12-23,#+33 4 20 13 03 77#contact@balamina.com#https://balamina.com/,,"La résidence hôtelière, le Balamina, ouverte à l'année, dipose de 53 chambres spacieuses et parfaitement équipées pour vous garantir un confort optimal tout au long de votre séjour.",https://data.datatourisme.fr/13/df5d29ec-55cd-37f3-a81f-f0db6c10c0f1
Jet Pearl Events,https://www.datatourisme.fr/ontology/core#PlaceOfInterest|https://www.datatourisme.fr/ontology/core#PointOfInterest|https://www.datatourisme.fr/ontology/core#ActivityProvider|https://www.datatourisme.fr/ontology/core#Store|http://schema.org/LocalBusiness,41.638077,9.347491,Parking de la plage Centre de Saint Cyprien,20137#Lecci,,,,,Porto Vecchio Tourisme,Apidae Tourisme Scic SA - source : Apidae Tourisme,2023-03-31,#+33 6 29 77 19 71#jetpearlevents@gmail.com#,,"Nous vous proposons au centre de Saint Cyprien des sorties sportives en jet-ski, des locations libres de quads et des randonnées en trottinettes électriques tout terrain entre terre et mer.",https://data.datatourisme.fr/13/66eb134c-fb35-3bd6-8e69-598d20ba0fdd
U casteddu d’Araghju,https://www.datatourisme.fr/ontology/core#ArcheologicalSite|https://www.datatourisme.fr/ontology/core#CulturalSite|https://www.datatourisme.fr/ontology/core#PlaceOfInterest|https://www.datatourisme.fr/ontology/core#PointOfInterest,41.656311,9.279691,Araghju,20170#San-Gavino-di-Carbini,,,,,Porto Vecchio Tourisme,Apidae Tourisme Scic SA - source : Apidae Tourisme,2022-05-20,#+33 4 95 70 09 58##,,"Forteresse cyclopéenne, aux remparts démesurés, plus de 2 mètres de largeur pour certains, le casteddu d’Araghju domine depuis plus de 4000 ans, la vaste plaine qui s’étend sous ses pieds offrant une vue imprenable le golfe de Porto-Vecchio.",https://data.datatourisme.fr/13/019b2930-944c-3019-8e9a-9fa4aaf10797
"Ceccia, site archéologique de l’âge du Bronze",https://www.datatourisme.fr/ontology/core#ArcheologicalSite|https://www.datatourisme.fr/ontology/core#CulturalSite|https://www.datatourisme.fr/ontology/core#PlaceOfInterest|https://www.datatourisme.fr/ontology/core#PointOfInterest,41.560031,9.242944,Village de Ceccia,20137#Porto-Vecchio,,,,,Porto Vecchio Tourisme,Apidae Tourisme Scic SA - source : Apidae Tourisme,2022-10-06,#+33 4 95 70 09 58##,,"À 5 min de Porto-Vecchio, un petit sentier au centre du village vous mènera à un monument circulaire d’environ 12 m de diamètre datant de 1350 av JC. Le panorama y est exceptionnel.",https://data.datatourisme.fr/13/327821ee-aa9c-37c6-b191-8605772d31b3
U Casteddu di Tappa,https://www.datatourisme.fr/ontology/core#ArcheologicalSite|https://www.datatourisme.fr/ontology/core#CulturalSite|https://www.datatourisme.fr/ontology/core#PlaceOfInterest|https://www.datatourisme.fr/ontology/core#PointOfInterest,41.552136,9.230978,Après le village de Ceccia Route de Sotta,20137#Porto-Vecchio,,,,,Porto Vecchio Tourisme,Apidae Tourisme Scic SA - source : Apidae Tourisme,2022-10-06,#+33 4 95 70 09 58##,,"À 10 min de Porto-Vecchio, découvrez ce complexe archéologique datant du IVe millénaire avant notre ère (âge du bronze) offrant un point de vue superbe.
Constitué d’une enceinte cyclopéenne entourant un village et renfermant une « torre » monumentale.",https://data.datatourisme.fr/13/70250137-d096-3fb9-879e-cc0cc78a4f9a
La plage de Santa Giulia,https://www.datatourisme.fr/ontology/core#PlaceOfInterest|https://www.datatourisme.fr/ontology/core#PointOfInterest|https://www.datatourisme.fr/ontology/core#SportsAndLeisurePlace|https://www.datatourisme.fr/ontology/core#Beach|https://www.datatourisme.fr/ontology/core#NaturalHeritage|http://schema.org/Landform,41.532755,9.271844,Santa Giulia,20137#Porto-Vecchio,,,,,Porto Vecchio Tourisme,Apidae Tourisme Scic SA - source : Apidae Tourisme,2022-09-30,#+33 4 95 70 09 58##,,"Au sud de Porto-Vecchio : voici une des plages les plus célèbres de la Corse du Sud.
Un lagon baignant au pied d’une montagne sur des kilomètres de sable blanc et fin... 
Ces eaux peu profondes en font un véritable jardin de la mer pour les enfants.",https://data.datatourisme.fr/13/2e597d03-e140-3847-ab52-aad5eed57e1d
La plage de Cala Rossa,https://www.datatourisme.fr/ontology/core#PlaceOfInterest|https://www.datatourisme.fr/ontology/core#PointOfInterest|https://www.datatourisme.fr/ontology/core#SportsAndLeisurePlace|https://www.datatourisme.fr/ontology/core#Beach|https://www.datatourisme.fr/ontology/core#NaturalHeritage|http://schema.org/Landform,41.620128,9.331364,Cala Rossa,20137#Lecci,,,,,Porto Vecchio Tourisme,Apidae Tourisme Scic SA - source : Apidae Tourisme,2022-09-30,#+33 4 95 71 05 75##,,"Un joyau de plus pour la commune de Lecci, Cala Rossa constitue un haut lieu pour le tourisme de grand standing. Un dégradé de vert et de bleu avec en toile de fond les Aiguilles de Bavella…",https://data.datatourisme.fr/13/4441e409-74b0-3ed3-8fc1-0c065d96e36a
La plage de San Giovanni,https://www.datatourisme.fr/ontology/core#PlaceOfInterest|https://www.datatourisme.fr/ontology/core#PointOfInterest|https://www.datatourisme.fr/ontology/core#SportsAndLeisurePlace|https://www.datatourisme.fr/ontology/core#Beach|https://www.datatourisme.fr/ontology/core#NaturalHeritage|http://schema.org/Landform,41.460968,9.046606,Saint Jean,20131#Pianottoli-Caldarello,,,,,Porto Vecchio Tourisme,Apidae Tourisme Scic SA - source : Apidae Tourisme,2023-04-01,#+33 4 95 71 80 06##,,"Entre la tour de Caldarello et la pointe de Capineru, se trouve la plage de San Giovanni (du nom des marais que l’on trouve à proximité). 
En continuant à pied le long de la plage, vous arriverez à la Tour génoise de Caldarellu.",https://data.datatourisme.fr/13/5730d0f7-ddf5-3d62-a564-3a336f9feaa3
La plage de Saint Cyprien,https://www.datatourisme.fr/ontology/core#PlaceOfInterest|https://www.datatourisme.fr/ontology/core#PointOfInterest|https://www.datatourisme.fr/ontology/core#SportsAndLeisurePlace|https://www.datatourisme.fr/ontology/core#Beach|https://www.datatourisme.fr/ontology/core#NaturalHeritage|http://schema.org/Landform,41.632348,9.345355,Saint Cyprien,20137#Lecci,,,,,Porto Vecchio Tourisme,Apidae Tourisme Scic SA - source : Apidae Tourisme,2022-09-30,#+33 4 95 71 05 75##,,"Ce petit golfe renferme une magnifique plage bordée par l’étang d’Arasu.
Une tour génoise domine ce site et de nombreux vestiges ont été découvert à proximité de l’embouchure de l’Osu.",https://data.datatourisme.fr/13/67672c80-bfd2-39b2-bf43-575dd094a6b6
Sentier du littoral de Tamaricciu,https://www.datatourisme.fr/ontology/core#PlaceOfInterest|https://www.datatourisme.fr/ontology/core#PointOfInterest|https://www.datatourisme.fr/ontology/core#SportsAndLeisurePlace|https://www.datatourisme.fr/ontology/core#Tour|https://www.datatourisme.fr/ontology/core#WalkingTour|https://www.datatourisme.fr/ontology/core#EducationalTrail|http://purl.org/ontology/olo/core#OrderedList,41.552777,9.312651,Tamaricciu,20137#Porto-Vecchio,,,,,Porto Vecchio Tourisme,Apidae Tourisme Scic SA - source : Apidae Tourisme,2022-04-20,#+33 4 95 70 09 58#accueil@destination-sudcorse.com#,,"Situé au nord de la réserve naturelle des Bouches de Bonifacio, Tamaricciu est, par la beauté et la diversité de ses milieux naturels, un site emblématique.",https://data.datatourisme.fr/13/6e5a3f80-2f7d-353c-91b6-55fab8c7b12c
La plage du Benedettu,https://www.datatourisme.fr/ontology/core#PlaceOfInterest|https://www.datatourisme.fr/ontology/core#PointOfInterest|https://www.datatourisme.fr/ontology/core#SportsAndLeisurePlace|https://www.datatourisme.fr/ontology/core#Beach|https://www.datatourisme.fr/ontology/core#NaturalHeritage|http://schema.org/Landform,41.616494,9.318192,Benedettu,20137#Lecci,,,,,Porto Vecchio Tourisme,Apidae Tourisme Scic SA - source : Apidae Tourisme,2022-09-30,#+33 4 95 71 05 75##,,"Encrée dans le golfe de Porto-Vecchio, une baie bénie par les dieux, autrement dit, un havre de paix…
La petite plage du Benedettu est blottie au fond de sa presqu’île du même nom, protégée par un oppidum romain.",https://data.datatourisme.fr/13/cc8155f4-b0a0-3e96-a70b-6c5333b41f93
